{"$schema":"http://json-schema.org/draft-07/schema#","$id":"https://agentic-website-studio.local/schemas/m43-expansion-contract.schema.json","type":"object","required":["schemaVersion","contractId","bindings","thesis","majorBearings","journeyState","localization","supportBoundary","originality","qaRequirements","humanGate"],"properties":{"schemaVersion":{"const":"1.0.0"},"contractId":{"const":"expansion_contract_wayfinder_m43_three_bearings_01"},"projectId":{"type":"string"},"selectedConceptId":{"type":"string"},"bindings":{"type":"object"},"thesis":{"type":"string"},"majorBearings":{"type":"array","minItems":3,"maxItems":3},"journeyState":{"type":"object"},"actStructure":{"type":"array"},"combinatorialStrategy":{"type":"string"},"localization":{"type":"object"},"supportBoundary":{"type":"object"},"originality":{"type":"object"},"qaRequirements":{"type":"array"},"humanGate":{"type":"object"}}}
